53§ozon.ru§https://ozon.ru§\N§Баннер на главной§\N§2024-11-30 10:33:24§2024-10-22 16:15:14§1§cbae0485-772e-11ef-9ba2-fe94ab6be75b.jpeg§https://cdn1.ozonusercontent.com/s3/sellerassets/ww1450_q80/cbae0485-772e-11ef-9ba2-fe94ab6be75b.jpeg§Ozon Fresh§Продукты питания§Рыбные продукты§Скидка до 50%§Использование ярких цветов, изображение свежих продуктов (лосось, авокадо, огурец), акцент на времени (секундомер) и скидке§5§3§1§1§3§4§1§3§1§2§3§2§4§1§1§3§109
54§ozon.ru§https://ozon.ru§\N§Баннер на главной§\N§2024-11-30 12:47:21§2024-10-16 15:52:43§1§ba602859-7f3b-11ef-b30b-b26c3ad1ae6b.jpeg§https://cdn1.ozonusercontent.com/s3/sellerassets/ww1450_q80/ba602859-7f3b-11ef-b30b-b26c3ad1ae6b.jpeg§Ozon§Магазины§Другие магазины (Москва, СПб)§Подарочные сертификаты§Яркие цвета, изображение подарочных карт, текст "Нет времени объяснять"§5§3§1§1§4§5§1§3§1§2§3§2§4§1§1§3§25
55§ozon.ru§https://ozon.ru§\N§Баннер на главной§\N§2024-10-16 15:52:43§2024-10-16 15:52:43§1§626e8d8c-70ee-11ef-a53e-eae4e7e33098.jpeg§https://cdn1.ozonusercontent.com/s3/sellerassets/ww1450_q80/626e8d8c-70ee-11ef-a53e-eae4e7e33098.jpeg§Ozon Travel§Отдых, путешествия, туризм§Туристические компании§Выгодные путешествия, билеты и отели§Яркий синий фон, изображение смартфона с приложением, акцент на выгодных предложениях§5§3§1§1§4§5§1§3§1§2§3§2§4§1§1§3§1
56§ozon.ru§https://ozon.ru§\N§Баннер на главной§\N§2024-10-17 17:15:14§2024-10-17 17:15:14§1§b502c47c-8acd-11ef-8d1d-3abb8cf3b0c4.jpeg§https://cdn1.ozonusercontent.com/s3/sellerassets/w1450_q80/b502c47c-8acd-11ef-8d1d-3abb8cf3b0c4.jpeg§Другое Дело§Услуги§Компании прямых продаж§Лекции, воркшопы, мастер-классы, новые знакомства. Вход бесплатный без регистрации.§Яркие цвета и формы, минималистичный дизайн, акцент на дате и времени проведения мероприятия.§4§3§1§1§3§5§1§3§1§2§3§1§4§1§1§3§1
57§ozon.ru§https://ozon.ru§\N§Баннер на главной§\N§2024-11-24 20:46:14§2024-10-23 14:15:14§1§c095b3cb-7fc3-11ef-935c-72cc26924a73.png§https://cdn1.ozonusercontent.com/s3/sellerassets/w1450_q80/c095b3cb-7fc3-11ef-935c-72cc26924a73.png§Ozon§Услуги§Почтовые и курьерские компании§Открытие пункта выдачи с поддержкой до 2 580 000 ₽§Яркий дизайн, изображение магазина, акцент на финансовую поддержку и возможности§4§3§1§1§3§5§1§3§1§4§3§1§4§1§1§4§26
58§ozon.ru§https://ozon.ru§\N§Баннер на главной§\N§2024-11-25 02:21:12§2024-10-24 15:30:15§1§ba9d653d-5556-11ef-9bbe-a617f69bc3df.jpeg§https://cdn1.ozonusercontent.com/s3/sellerassets/ww1450_q80/ba9d653d-5556-11ef-9bbe-a617f69bc3df.jpeg§Ozon Travel§Отдых, путешествия, туризм§Туристические компании§Билеты и отели по выгодным ценам§Яркий фон, изображение самолета, логотип Ozon Travel, текстовое сообщение§5§3§1§1§4§5§1§3§1§2§3§2§4§1§1§3§52
60§ozon.ru§https://ozon.ru§\N§Баннер на главной§\N§2024-10-29 10:15:16§2024-10-23 00:30:15§1§9d77244e-8b97-11ef-a3c0-deb5f0e0c603.jpeg§https://cdn1.ozonusercontent.com/s3/sellerassets/ww1450_q80/9d77244e-8b97-11ef-a3c0-deb5f0e0c603.jpeg§KRASAR§Одежда, обувь и аксессуары§Одежда§Футболки с изображением змеи, подарок к Новому году§Использование изображения змеи, фоновая текстура, акцент на подарке к Новому году§3§4§2§5§3§4§1§3§1§5§3§2§4§2§1§3§22
61§ozon.ru§https://ozon.ru§\N§Баннер на главной§\N§2024-10-16 18:15:14§2024-10-16 18:15:14§1§0bc57877-815c-11ef-9456-cab8c55db4d4.jpeg§https://cdn1.ozonusercontent.com/s3/sellerassets/ww1450_q80/0bc57877-815c-11ef-9456-cab8c55db4d4.jpeg§Яндекс Go§Услуги§Почтовые и курьерские компании§Новый сервис Яндекс Go§Яркий дизайн с использованием желтого цвета, динамичные элементы, логотипы§5§4§1§1§4§5§1§4§1§3§4§2§5§1§1§4§1
62§ozon.ru§https://ozon.ru§\N§Баннер на главной§\N§2024-10-16 18:30:14§2024-10-16 18:30:14§1§dd5f9e81-8aeb-11ef-91e2-b69902a9109e.jpeg§https://cdn1.ozonusercontent.com/s3/sellerassets/ww1450_q80/dd5f9e81-8aeb-11ef-91e2-b69902a9109e.jpeg§Не указан§Одежда, обувь и аксессуары§Одежда§Спортивные костюмы от 40 до 72 размера§Использование контраста в цветах, акцент на широкий размерный ряд, обращение к клиенту с благодарностью за выбор§3§2§1§1§3§2§1§3§1§2§2§1§3§1§1§2§1
64§ozon.ru§https://ozon.ru§\N§Баннер на главной§\N§2024-10-16 20:30:14§2024-10-16 20:30:14§1§1ba58989-87e6-11ef-9629-223d914741dc.jpeg§https://cdn1.ozonusercontent.com/s3/sellerassets/ww1450_q80/1ba58989-87e6-11ef-9629-223d914741dc.jpeg§Krasava§Одежда, обувь и аксессуары§Одежда§Футболки со змеей в качестве подарка к Новому году§- Темный фон с эффектом потрескавшейся текстуры - Изображение змеи в центре - Логотип бренда с крыльями по бокам - Крупный белый текст с акцентом на "подарок"§3§2§1§4§2§3§1§2§2§5§2§1§4§3§2§3§1
65§ozon.ru§https://ozon.ru§\N§Баннер на главной§\N§2024-10-29 06:45:15§2024-10-22 23:30:14§1§e822c695-7b41-11ef-9d1f-3a6c65a4caad.jpeg§https://cdn1.ozonusercontent.com/s3/sellerassets/ww1450_q80/e822c695-7b41-11ef-9d1f-3a6c65a4caad.jpeg§Nescafe§Безалкогольные напитки§Горячие напитки§Скидки до 65% на кофе Nescafe в интернет-магазине OZON§- Красный фон, соответствующий фирменному цвету Nescafe - Изображения продуктов (растворимый кофе, стики) - Фото с чашкой кофе, создающее атмосферу уюта - Слоган "Выберите кофе для бодрого начала дня" - Акцент на большую скидку (до 65%)§5§2§1§1§3§5§1§4§1§3§2§1§4§1§1§2§20
66§ozon.ru§https://ozon.ru§\N§Баннер на главной§\N§2024-10-23 13:45:14§2024-10-23 13:45:14§1§188f3492-5118-11ef-958a-a680467f51eb.jpeg§https://cdn1.ozonusercontent.com/s3/sellerassets/ww1450_q80/188f3492-5118-11ef-958a-a680467f51eb.jpeg§Ozon Fresh§Продукты питания§Мясные продукты (мясо, птица, колбасные изделия, мясные деликатесы, покупные паштеты)§Свежие продукты от локальных поставщиков§Яркие изображения мяса, использование зелени для акцента, контрастный фон§4§3§1§1§3§4§1§3§1§2§3§1§2§1§1§2§15
67§ozon.ru§https://ozon.ru§\N§Баннер на главной§\N§2024-10-29 11:30:14§2024-10-23 00:45:15§1§c98901f3-542a-11ef-8cca-664ea8e4941b.jpeg§https://cdn1.ozonusercontent.com/s3/sellerassets/ww1450_q80/c98901f3-542a-11ef-8cca-664ea8e4941b.jpeg§OZON Fresh§Продукты питания, Уход, косметика, парфюмерия§Рыбные продукты, Покупные торты, Средства по уходу за кожей тела§Включает в себя рыбу, кондитерские изделия (торты) и косметические средства.§Яркий и привлекательный дизайн с изображениями продуктов и косметики, акцент на новинки.§5§4§1§1§3§5§1§4§1§3§4§2§6§1§2§5§11
68§ozon.ru§https://ozon.ru§\N§Баннер на главной§\N§2024-11-27 19:23:28§2024-10-26 04:45:14§1§1b34eac0-ca45-11ee-ae16-4a20f955155d.jpeg§https://cdn1.ozonusercontent.com/s3/sellerassets/ww1450_q80/1b34eac0-ca45-11ee-ae16-4a20f955155d.jpeg§SYNERGETIC§Бытовая химия§Чистящие средства§Сдайте вторсырьё — получите скидку 50 ₽ на SYNERGETIC§Зеленый экомобиль, акцент на экологичность и переработку, яркие цвета§4§5§1§1§4§5§1§5§1§3§4§1§4§1§1§3§21
69§ozon.ru§https://ozon.ru§\N§Баннер на главной§\N§2024-10-17 00:15:14§2024-10-17 00:15:14§1§395d0d91-858d-11ef-80fd-46cf6c6eb2a0.jpeg§https://cdn1.ozonusercontent.com/s3/sellerassets/ww1450_q80/395d0d91-858d-11ef-80fd-46cf6c6eb2a0.jpeg§Munich§Одежда, обувь и аксессуары§Обувь§Оригинальная футзальная обувь Munich X§Яркие цвета, акцент на спортивной обуви, логотип бренда§4§3§1§1§3§5§1§3§1§4§2§2§3§1§1§4§1
70§ozon.ru§https://ozon.ru§\N§Баннер на главной§\N§2024-10-17 00:15:14§2024-10-17 00:15:14§1§313c0265-8b0a-11ef-9042-ba53e1b0f1e4.jpeg§https://cdn1.ozonusercontent.com/s3/sellerassets/ww1450_q80/313c0265-8b0a-11ef-9042-ba53e1b0f1e4.jpeg§Яндекс Плюс и S7 Airlines§Отдых, путешествия, туризм§Авиакомпании§Скидки до 50% на авиабилеты 22 октября для подписчиков Яндекс Плюс с опцией «Путешественникам»§Использование ярких цветов, изображение чемодана, логотипы брендов, акцент на скидке§5§4§1§1§4§5§1§3§1§2§3§2§4§1§1§3§1
71§ozon.ru§https://ozon.ru§\N§Баннер на главной§\N§2024-10-17 00:15:14§2024-10-17 00:15:14§1§cd398187-7cb8-11ef-b256-5ed616112760.jpeg§https://cdn1.ozonusercontent.com/s3/sellerassets/ww1450_q80/cd398187-7cb8-11ef-b256-5ed616112760.jpeg§CASE-IN§Услуги§Компании прямых продаж§Получение дополнительных баллов ЕГЭ и поступление в вуз§Яркие цвета, позитивный настрой, акцент на образовательные возможности§6§4§1§1§5§6§1§4§1§3§4§2§5§1§1§5§1
72§ozon.ru§https://ozon.ru§\N§Баннер на главной§\N§2024-10-17 00:30:15§2024-10-17 00:30:15§1§ca0bce61-819e-11ef-bf64-822adda5727e.jpeg§https://cdn1.ozonusercontent.com/s3/sellerassets/ww1450_q80/ca0bce61-819e-11ef-bf64-822adda5727e.jpeg§Яндекс Плюс и Яндекс Пэй§Финансы и страхование§Банковский счет, банковские карты§Громовой кешбэк: развлечения и выгода в одной подписке§Использование ярких персонажей в стиле шпионского фильма, фокус на выгоде и развлечениях, визуально привлекательный фон§4§3§2§2§4§5§1§3§1§4§3§2§4§1§1§3§1
73§ozon.ru§https://ozon.ru§\N§Баннер на главной§\N§2024-10-17 00:30:15§2024-10-17 00:30:15§1§e85a03ce-826e-11ef-a8e3-7a92d4c8da96.jpeg§https://cdn1.ozonusercontent.com/s3/sellerassets/ww1450_q80/e85a03ce-826e-11ef-a8e3-7a92d4c8da96.jpeg§ACUVUE§Услуги§Магазины оптики (Москва, СПб)§Скидка до 15% на контактные линзы ACUVUE§Яркий фон с изображением геймера, акцент на здоровье глаз и скидку§4§3§1§1§3§4§1§3§1§2§3§1§3§1§1§2§1
74§ozon.ru§https://ozon.ru§\N§Баннер на главной§\N§2024-10-17 00:45:14§2024-10-17 00:45:14§1§0f0ed2cb-8bc5-11ef-b30e-8e1c88f1eef7.jpeg§https://cdn1.ozonusercontent.com/s3/sellerassets/ww1450_q80/0f0ed2cb-8bc5-11ef-b30e-8e1c88f1eef7.jpeg§Яндекс Плюс§Финансы и страхование§Банковский счет, банковские карты§Подписка, объединяющая развлечения и финансовые выгоды§Изображение вратаря, отражающего мяч, символизирующее "сейв" или защиту. Фиолетовый фон, акцент на тексте "Сейв года".§4§3§1§1§3§5§1§4§1§5§3§2§4§1§2§4§1
75§ozon.ru§https://ozon.ru§\N§Баннер на главной§\N§2024-10-26 03:30:15§2024-10-26 03:30:15§1§25bc8e4f-8b05-11ef-ba9b-4ec8c4bd3a4f.jpeg§https://cdn1.ozonusercontent.com/s3/sellerassets/ww1450_q80/25bc8e4f-8b05-11ef-ba9b-4ec8c4bd3a4f.jpeg§МТС Телеком§Услуги§Услуги связи§SIM-карта с балансом 1700 рублей со скидкой 40%§- Яркий красно-розовый градиентный фон - Крупный белый текст с акцентом на "безграничную щедрость" - Изображение SIM-карты в виде подарка с бантиком - Кнопки для выбора тарифа и активации дома - Логотип МТС в правом верхнем углу§5§3§1§1§4§5§1§4§1§3§4§2§3§1§2§2§3
76§ozon.ru§https://ozon.ru§\N§Баннер на главной§\N§2024-10-17 01:15:14§2024-10-17 01:15:14§1§142556f8-7f49-11ef-8dca-06d5a1a9deaa.jpeg§https://cdn1.ozonusercontent.com/s3/sellerassets/ww1450_q80/142556f8-7f49-11ef-8dca-06d5a1a9deaa.jpeg§Сбер Бизнес§Финансы и страхование§Банки§Подключение эквайринга по сниженной ставке 0,3%§Зеленый цвет, символика Сбербанка, изображение терминала для оплаты§3§4§1§1§4§3§1§4§1§2§5§1§3§1§1§2§1
77§ozon.ru§https://ozon.ru§\N§Баннер на главной§\N§2024-10-17 01:45:15§2024-10-17 01:45:15§1§af9aa8e4-80ab-11ef-aecf-02ca0cff91cf.jpeg§https://cdn1.ozonusercontent.com/s3/sellerassets/ww1450_q80/af9aa8e4-80ab-11ef-aecf-02ca0cff91cf.jpeg§LADA§Автомобиль§Автомобиль§Автомобиль LADA Vesta SW Cross с автоматической трансмиссией. Выгода до 388,000 руб.§Изображение автомобиля на мосту, акцент на выгоде, логотип LADA.§3§4§1§1§5§3§1§4§1§4§5§2§3§1§1§3§1
78§ozon.ru§https://ozon.ru§\N§Баннер на главной§\N§2024-10-23 16:15:14§2024-10-23 16:15:14§1§4db31a83-7f36-11ef-9d9c-d638bedb0a14.jpeg§https://cdn1.ozonusercontent.com/s3/sellerassets/ww1450_q80/4db31a83-7f36-11ef-9d9c-d638bedb0a14.jpeg§Не указан§Не определена§Не определена§Скидки§Яркие цвета, 3D-эффект, облака§4§1§1§1§2§3§1§2§1§2§1§1§2§1§1§2§38
79§ozon.ru§https://ozon.ru§\N§Баннер на главной§\N§2024-10-17 03:45:14§2024-10-17 03:45:14§1§00a4ae45-6905-11ef-bf5e-e29d72ece721.jpeg§https://cdn1.ozonusercontent.com/s3/sellerassets/ww1450_q80/00a4ae45-6905-11ef-bf5e-e29d72ece721.jpeg§auto.ru§Автомобиль§Автомобиль§Новые автомобили§Яркий красный фон, крупный текст "auto.ru", изображение автомобиля, акцент на новизне автомобилей§4§3§1§1§3§5§1§3§1§4§3§2§4§1§1§4§1
80§ozon.ru§https://ozon.ru§\N§Баннер на главной§\N§2024-10-29 18:45:15§2024-10-23 11:15:15§1§69251258-7f36-11ef-bec3-c6f837701e4a.jpeg§https://cdn1.ozonusercontent.com/s3/sellerassets/ww1450_q80/69251258-7f36-11ef-bec3-c6f837701e4a.jpeg§Не определен§Не определена§Не определена§Скидка до 90%§Яркий фон с геометрическим узором; крупный текст с указанием скидки§3§1§1§1§1§4§1§1§1§2§1§2§2§1§2§2§31
81§ozon.ru§https://ozon.ru§\N§Баннер на главной§\N§2024-10-24 19:15:15§2024-10-24 19:15:15§1§c4901a23-87e5-11ef-9629-223d914741dc.jpeg§https://cdn1.ozonusercontent.com/s3/sellerassets/ww1450_q80/c4901a23-87e5-11ef-9629-223d914741dc.jpeg§KRASAR§Одежда, обувь и аксессуары§Одежда§Футболки с изображением змеи, предлагаемые в качестве подарка к Новому году§Использование яркого и контрастного фона с изображением змеи, акцент на уникальном дизайне футболок и новогоднем предложении§3§4§2§2§4§3§1§3§1§4§3§2§3§1§1§3§9
83§ozon.ru§https://ozon.ru§\N§Баннер на главной§\N§2024-10-17 12:15:14§2024-10-17 12:15:14§1§743a1468-8bb7-11ef-be3c-1e6029508c1d.jpeg§https://cdn1.ozonusercontent.com/s3/sellerassets/ww1450_q80/743a1468-8bb7-11ef-be3c-1e6029508c1d.jpeg§Herbarus§Безалкогольные напитки§Горячие напитки§Чай с предсказаниями. Ассортимент включает различные виды чая, представленные в упаковках и коробке.§Тематика астрологии и предсказаний, изображение луны и звезд, космический фон, акцент на уникальности продукта (чай с предсказаниями).§5§4§1§1§3§6§1§3§1§2§3§1§5§1§1§4§1
84§ozon.ru§https://ozon.ru§\N§Баннер на главной§\N§2024-10-23 13:45:14§2024-10-23 13:45:14§1§906c97a9-7f3d-11ef-aa43-e2e14c06ae23.png§https://cdn1.ozonusercontent.com/s3/sellerassets/ww1450_q80/906c97a9-7f3d-11ef-aa43-e2e14c06ae23.png§Не указан на баннере§Неопределено (нет явных указаний на продукт)§Неопределено§"Новые волны предложений!" в 14:00 и 18:00 (МСК)§Яркий розовый фон, изображение секундомера, крупный текст, акцент на времени§4§2§1§1§3§5§1§2§1§3§2§1§3§1§1§2§19
85§ozon.ru§https://ozon.ru§\N§Баннер на главной§\N§2024-10-23 14:15:15§2024-10-23 14:15:15§1§8449b0e7-542d-11ef-87d7-a2e0a07b86ac.jpeg§https://cdn1.ozonusercontent.com/s3/sellerassets/ww1450_q80/8449b0e7-542d-11ef-87d7-a2e0a07b86ac.jpeg§Ozon Fresh§Продукты питания§Рыбные продукты, Молочные продукты§Бесплатная доставка за 30 минут§Яркий фон, изображения продуктов (лосось, сыр, авокадо, яблоко), акцент на быстроте доставки§5§4§1§1§3§4§1§4§1§2§3§2§4§1§1§3§8
86§ozon.ru§https://ozon.ru§\N§Баннер на главной§\N§2024-12-01 10:45:52§2024-10-17 12:45:15§1§29aa3bd7-6615-11ef-a006-0ed03a29cae5.jpeg§https://cdn1.ozonusercontent.com/s3/sellerassets/ww1450_q80/29aa3bd7-6615-11ef-a006-0ed03a29cae5.jpeg§Не указан§Продукты питания§Специи и приправы§Скидка до 50% на свежие продукты напрямую от продавцов§Визуальное изображение свежих продуктов, таких как ягоды и авокадо. Использование ярких цветов для привлечения внимания.§5§2§1§1§3§4§1§3§1§2§2§1§3§1§1§2§38
89§ozon.ru§https://ozon.ru§\N§Баннер на главной§\N§2024-11-30 03:46:01§2024-10-26 01:30:15§1§1b70168d-5233-11ef-a92e-420e3899c99e.jpeg§https://cdn1.ozonusercontent.com/s3/sellerassets/ww1450_q80/1b70168d-5233-11ef-a92e-420e3899c99e.jpeg§Ozon Fresh§Продукты питания§Молочные продукты, Кексы, рулеты, бисквиты, круассаны, Зубная паста, щетки§Скидки до 80% на различные продукты питания и средства гигиены§Яркий фон, изображение продуктов (авокадо, сыр, круассан), акцент на скидках§5§3§1§1§4§4§1§3§1§2§3§1§4§1§2§3§34
91§ozon.ru§https://ozon.ru§\N§Баннер на главной§\N§2024-10-25 09:45:14§2024-10-25 09:45:14§1§465cd66b-69f5-11ef-9bbb-faf9b729d567.jpeg§https://cdn1.ozonusercontent.com/s3/sellerassets/ww1450_q80/465cd66b-69f5-11ef-9bbb-faf9b729d567.jpeg§Система быстрых платежей (СБПэй)§Финансы и страхование§Банковский счет, банковские карты§Кэшбэк 15 рублей при оплате в метро по биометрии§Яркий дизайн, изображение девушки с телефоном, акцент на кэшбэк и биометрию§4§3§1§1§4§5§1§4§1§2§4§1§3§1§1§3§4
92§ozon.ru§https://ozon.ru§\N§Баннер на главной§\N§2024-10-28 15:45:14§2024-10-17 16:30:15§1§29a526ee-8aef-11ef-a55f-96921b98f484.jpeg§https://cdn1.ozonusercontent.com/s3/sellerassets/ww1450_q80/29a526ee-8aef-11ef-a55f-96921b98f484.jpeg§Ozon Fresh§Продукты питания§Замороженные продукты§Баннер рекламирует продукты, связанные с Хэллоуином, включая мороженое и тыквы.§Использование тематических элементов Хэллоуина: тыквы, пауки, жевательные червячки.§5§3§1§2§3§4§1§3§1§2§3§2§4§1§1§3§7
93§ozon.ru§https://ozon.ru§\N§Баннер на главной§\N§2024-10-26 09:30:14§2024-10-26 09:30:14§1§8719fc1c-7b5f-11ef-94b4-ea1e1461c399.jpeg§https://cdn1.ozonusercontent.com/s3/sellerassets/ww1450_q80/8719fc1c-7b5f-11ef-94b4-ea1e1461c399.jpeg§Ozon Fresh§Продукты питания§Покупные фруктовые и овощные соки, нектары, напитки§Свежие фрукты и овощи (манго, тыква, виноград, яблоко, помидор)§Яркий фиолетовый фон, сочные изображения фруктов и овощей, акцент на свежести§5§3§1§1§4§5§1§3§1§2§3§2§4§1§1§3§10
94§ozon.ru§https://ozon.ru§\N§Баннер на главной§\N§2024-10-17 18:30:14§2024-10-17 18:30:14§1§572436a9-5235-11ef-8e6a-3a8d6aa04cab.jpeg§https://cdn1.ozonusercontent.com/s3/sellerassets/ww1450_q80/572436a9-5235-11ef-8e6a-3a8d6aa04cab.jpeg§Ozon Fresh§Продукты питания§Магазины продуктов питания§Свежие фрукты и овощи§Яркие изображения фруктов и овощей, надпись "С РЫНКА", акцент на свежесть и натуральность§5§3§1§1§4§5§1§3§1§2§3§1§4§1§1§3§1
95§ozon.ru§https://ozon.ru§\N§Баннер на главной§\N§2024-11-28 01:45:49§2024-10-17 22:30:15§1§e00e5e5c-f409-11ee-9e57-469eeddc67ab.jpeg§https://cdn1.ozonusercontent.com/s3/sellerassets/ww1450_q80/e00e5e5c-f409-11ee-9e57-469eeddc67ab.jpeg§Ганза§Одежда, обувь и аксессуары§Одежда§Скидки до 70%§Использование силуэтов людей, акцент на скидках, стильный минималистичный дизайн§3§2§1§1§3§4§1§3§1§2§2§1§3§1§1§2§17
96§ozon.ru§https://ozon.ru§\N§Баннер на главной§\N§2024-10-25 00:15:14§2024-10-25 00:15:14§1§0b9218a7-7c11-11ef-8e5f-9a8d25b99ff6.jpeg§https://cdn1.ozonusercontent.com/s3/sellerassets/ww1450_q80/0b9218a7-7c11-11ef-8e5f-9a8d25b99ff6.jpeg§МСП.РФ§Услуги§Компании прямых продаж§Информация о мерах поддержки предпринимателей, национальные проекты России.§Использование образа женщины в традиционной одежде, акцент на поддержку предпринимательства.§5§4§1§1§4§5§1§4§1§3§5§1§4§1§1§5§6
